{
  "schema_version": "npc.lipsync-qualification-plan/v1",
  "plan_id": "qualify.audio2face-3d-regression-v2.3-mark.windows-x64",
  "candidate_id": "audio2face-3d-regression-v2.3",
  "display_name": "Audio2Face-3D regression v2.3 Mark Windows qualification",
  "descriptor_kind": "non_downloadable_qualification_plan",
  "selection": {
    "contains_download_locations": false,
    "contains_model_payloads": false,
    "automatic_download": false,
    "default_candidate": false,
    "live_selectable": false,
    "offline_selectable": false,
    "activation_state": "blocked_pending_qualification"
  },
  "source_identity": {
    "publisher": "NVIDIA",
    "model_family": "Audio2Face-3D",
    "model_variant": "Mark",
    "model_version": "2.3",
    "model_revision": "5451728e07378df93b04523279e134a9993ae71b",
    "revision_kind": "immutable_git_commit",
    "access": "public_ungated",
    "sdk_source_revision_policy": "exact_commit_required_before_build",
    "model_license": "NVIDIA Open Model License",
    "sdk_license": "MIT",
    "license_qualification": "pending_exact_text_and_redistribution_review"
  },
  "io_contract": {
    "input": {
      "modality": "speech_pcm",
      "sample_rate_hz": 16000,
      "channels": 1,
      "sample_format": "signed_16_bit_little_endian",
      "streaming": true
    },
    "output": {
      "modality": "timestamped_arkit_blendshape_coefficients",
      "coefficient_namespace": "arkit_52",
      "coefficient_cadence_hz": 60,
      "source_timestamp_basis": "source_audio_sample_index",
      "delivery_timestamp_basis": "query_performance_counter",
      "sequence_policy": "strictly_monotonic",
      "non_finite_policy": "reject_frame_and_fail_open"
    }
  },
  "residual_mapper_contract": {
    "output_contract": "npc.mouth-residual/v1",
    "mouth_coefficient_allowlist": [
      "jawForward",
      "jawLeft",
      "jawOpen",
      "jawRight",
      "mouthClose",
      "mouthDimpleLeft",
      "mouthDimpleRight",
      "mouthFrownLeft",
      "mouthFrownRight",
      "mouthFunnel",
      "mouthLeft",
      "mouthLowerDownLeft",
      "mouthLowerDownRight",
      "mouthPressLeft",
      "mouthPressRight",
      "mouthPucker",
      "mouthRight",
      "mouthRollLower",
      "mouthRollUpper",
      "mouthShrugLower",
      "mouthShrugUpper",
      "mouthSmileLeft",
      "mouthSmileRight",
      "mouthStretchLeft",
      "mouthStretchRight",
      "mouthUpperUpLeft",
      "mouthUpperUpRight",
      "tongueOut"
    ],
    "non_mouth_coefficient_policy": "discard",
    "full_frame_replacement": false,
    "static_avatar_source": false,
    "base_frame_mutation": false,
    "alpha_outside_mask_zero": true,
    "mask_must_remain_inside_landmarks": true,
    "maximum_source_frame_advance": 0,
    "maximum_displayed_frames": 1,
    "fail_open_to_unmodified_frame": true,
    "required_bindings": [
      "frame_lease_id",
      "source_frame_sequence",
      "selected_encounter_id",
      "selected_track_id",
      "track_epoch",
      "landmark_bounds_normalized",
      "mouth_mask_bounds_normalized",
      "cancellation_generation"
    ]
  },
  "expected_environment": {
    "platforms": ["windows_10_22h2_x64", "windows_11_x64"],
    "architecture": "x86_64",
    "build_configuration": "release",
    "compiler": "msvc_visual_studio_2022",
    "cuda": {
      "minimum": "12.8.0",
      "maximum_exclusive": "13.0.0",
      "reference": "12.9.0"
    },
    "tensorrt": {
      "minimum": "10.13.0",
      "maximum_exclusive": "11.0.0",
      "reference": "10.13.0"
    },
    "gpu": {
      "vendor": "nvidia",
      "minimum_compute_capability": "7.5",
      "reference_target": "rtx_4080_laptop_12_gib",
      "lower_memory_gate": "separate_6_gib_and_8_gib_measurement_required"
    },
    "minimum_system_ram_mib": 8192,
    "minimum_free_storage_mib": 10240,
    "runtime_network_access": false,
    "qualification_power_profiles": ["silent_cpu_boost_disabled", "balanced"]
  },
  "resource_admission": {
    "budget_source": "dxgi_query_video_memory_info",
    "local_visual_gpu_lease": "exclusive",
    "co_resident_local_models": "not_permitted_during_initial_qualification",
    "safety_margin_mib": 512,
    "required_peak_statistic": "measured_vram_p99_mib",
    "admission_formula": "budget_mib-current_usage_mib-configured_game_reserve_mib-safety_margin_mib>=measured_vram_p99_mib",
    "on_rejection": "remain_unselectable_without_cloud_fallback"
  },
  "measurement_plan": {
    "status": "not_measured",
    "observations": {},
    "workload": {
      "warmup_frames": 600,
      "minimum_measured_frames": 18000,
      "soak_minutes": 30,
      "coefficient_cadence_hz": 60,
      "capture_fixture": "original_or_licensed_moving_game_face_replay_with_pose_and_occlusion",
      "audio_fixture": "hash_attested_speech_pcm_with_phoneme_and_silence_coverage",
      "stress_events": [
        "barge_in_cancellation",
        "track_epoch_change",
        "face_occlusion",
        "source_frame_advance",
        "device_loss",
        "gpu_budget_pressure"
      ]
    },
    "required_record_fields": [
      "sdk_commit",
      "model_revision",
      "worker_commit",
      "benchmark_revision",
      "measurement_utc",
      "windows_build",
      "gpu_name",
      "gpu_driver",
      "cuda_version",
      "tensorrt_version",
      "power_profile",
      "dxgi_budget_mib",
      "configured_game_reserve_mib",
      "fixture_hashes"
    ],
    "acceptance_thresholds": {
      "coefficient_compute_ms_p95_max": 16.6,
      "first_coefficient_ms_p95_max": 100,
      "audio_to_residual_ready_ms_p95_max": 50,
      "residual_composite_ms_p95_max": 0.5,
      "audio_visual_onset_skew_abs_ms_p95_max": 80,
      "average_game_fps_loss_percent_max": 3,
      "one_percent_low_fps_loss_percent_max": 5,
      "deadline_miss_percent_max": 0.1,
      "outside_mask_changed_pixel_percent_max": 0.1,
      "stale_or_wrong_track_presentations_max": 0,
      "restore_unmodified_within_displayed_frames_max": 1,
      "crashes_or_orphan_workers_max": 0
    }
  },
  "activation_gates": [
    "exact_sdk_commit_pinned",
    "artifact_hashes_and_sizes_recorded",
    "tensor_rt_engine_built_for_qualified_gpu",
    "cuda_tensor_rt_abi_match",
    "exact_license_text_reviewed",
    "worker_sandbox_and_no_egress_verified",
    "timestamped_arkit_coefficient_conformance",
    "strict_mouth_residual_conformance",
    "dxgi_resource_admission_passed",
    "latency_and_frame_impact_thresholds_passed",
    "occlusion_identity_freshness_and_cancellation_passed",
    "thirty_minute_soak_passed"
  ]
}
